ambiguity,fileid,nps,numbers,sent
,ca02,,,"The bill's defenders were mostly small-town legislators like J. W. Buchanan of Dumas, Eligio (Kika) De La Garza of Mission, Sam F. Collins of Newton and Joe Chapman of Sulphur Springs."
Oxford,ca02,J. W. Buchanan of Dumas~~~Eligio -LRB- Kika -RRB- De La Garza of Mission~~~Sam F. Collins of Newton~~~Joe Chapman of Sulphur Springs,"['S', 'S', 'S', 'S']","The bill's defenders were mostly small-town legislators like J. W. Buchanan of Dumas, Eligio (Kika) De La Garza of Mission, Sam F. Collins of Newton and Joe Chapman of Sulphur Springs."
,ca02,,,"`` This is a poor boy's bill '', said Chapman."
,ca02,,,`` Dallas and Fort Worth can vote bonds.
,ca02,,,This would help the little peanut districts ''.
,ca02,,,"Austin, Texas"
,ca02,,,"-- A Houston teacher, now serving in the Legislature, proposed Thursday a law reducing the time spent learning `` educational methods ''."
,ca02,,,"Rep. Henry C. Grover, who teaches history in the Houston public schools, would reduce from 24 to 12 semester hours the so-called `` teaching methods '' courses required to obtain a junior or senior high school teaching certificate."
,ca02,,,A normal year's work in college is 30 semester hours.
,ca02,,,Grover also would require junior-senior high teachers to have at least 24 semester hours credit in the subject they are teaching.
,ca02,,,The remainder of the 4-year college requirement would be in general subjects.
,ca02,,,"`` A person with a master's degree in physics, chemistry, math or English, yet who has not taken Education courses, is not permitted to teach in the public schools '', said Grover."
Oxford,ca02,physics~~~chemistry~~~math~~~English,"['P', 'S', 'S', 'S']","`` A person with a master's degree in physics, chemistry, math or English, yet who has not taken Education courses, is not permitted to teach in the public schools '', said Grover."
,ca02,,,College teachers in Texas are not required to have the Education courses.
,ca02,,,Fifty-three of the 150 representatives immediately joined Grover as co-signers of the proposal.
,ca02,,,"Paris, Texas (sp.)"
,ca02,,,"-- The board of regents of Paris Junior College has named Dr. Clarence Charles Clark of Hays, Kan. as the school's new president."
,ca02,,,"Dr. Clark will succeed Dr. J. R. McLemore, who will retire at the close of the present school term."
,ca02,,,Dr. Clark holds an earned Doctor of Education degree from the University of Oklahoma.
,ca02,,,"He also received a Master of Science degree from Texas A & I College and a Bachelor of Science degree from Southwestern State College, Weatherford, Okla.."
,ca02,,,"In addition, Dr. Clark has studied at Rhode Island State College and Massachusetts Institute of Technology."
,ca02,,,"During his college career, Dr. Clark was captain of his basketball team and was a football letterman."
,ca02,,,"Dr. Clark has served as teacher and principal in Oklahoma high schools, as teacher and athletic director at Raymondville, Texas, High School, as an instructor at the University of Oklahoma, and as an associate professor of education at Fort Hays, Kan., State College."
,ca02,,,He has served as a border patrolman and was in the Signal Corps of the U.S. Army.
,ca02,,,"Denton, Texas (sp.)"
,ca02,,,-- Principals of the 13 schools in the Denton Independent School District have been re-elected for the 1961-62 session upon the recommendation of Supt. Chester O. Strickland.
,ca02,,,State and federal legislation against racial discrimination in employment was called for yesterday in a report of a `` blue ribbon '' citizens committee on the aid to dependent children program.
,ca02,,,"The report, culminating a year long study of the ADC program in Cook county by a New York City welfare consulting firm, listed 10 long range recommendations designed to reduce the soaring ADC case load."
,ca02,,,"The report called racial discrimination in employment `` one of the most serious causes of family breakdown, desertion, and ADC dependency ''."
Oxford,ca02,family breakdown~~~desertion~~~ADC dependency,"['S', 'S', 'S']","The report called racial discrimination in employment `` one of the most serious causes of family breakdown, desertion, and ADC dependency ''."
,ca02,,,`` Must solve problem ''
,ca02,,,"The monthly cost of ADC to more than 100,000 recipients in the county is 4.4 million dollars, said C. Virgil Martin, president of Carson Pirie Scott & Co., committee chairman."
,ca02,,,"`` We must solve the problems which have forced these people to depend upon ADC for subsistence '', Martin said."
,ca02,,,"The volume of ADC cases will decrease, Martin reported, when the community is able to deal effectively with two problems : Relatively limited skills and discrimination in employment because of color."
,ca02,,,"These, he said, are `` two of the principal underlying causes for family breakups leading to ADC ''."
,ca02,,,Calls for extension
,ca02,,,Other recommendations made by the committee are :
,ca02,,,"Extension of the ADC program to all children in need living with any relatives, including both parents, as a means of preserving family unity."
,ca02,,,Research projects as soon as possible on the causes and prevention of dependency and illegitimacy.
